[
  {
    "id": "route-anthropic-sonnet-direct",
    "modelId": "anthropic-claude-sonnet-4-6",
    "providerId": "anthropic",
    "routeType": "direct",
    "label": "Anthropic direct API",
    "baseUrl": "https://api.anthropic.com",
    "authMethod": "api-key",
    "requiredSecrets": ["ANTHROPIC_API_KEY"],
    "supportsStreaming": true,
    "supportsTools": true,
    "supportsStructuredOutput": true,
    "supportsReasoningMode": true,
    "status": "active",
    "recordStatus": "reviewed",
    "sourceUrl": "https://docs.anthropic.com/",
    "lastVerifiedAt": "2026-04-28"
  },
  {
    "id": "route-openai-gpt54-direct",
    "modelId": "openai-gpt-5-4",
    "providerId": "openai",
    "routeType": "direct",
    "label": "OpenAI direct API",
    "baseUrl": "https://api.openai.com/v1",
    "authMethod": "api-key",
    "requiredSecrets": ["OPENAI_API_KEY"],
    "supportsStreaming": true,
    "supportsTools": true,
    "supportsStructuredOutput": true,
    "supportsReasoningMode": true,
    "status": "active",
    "recordStatus": "reviewed",
    "sourceUrl": "https://platform.openai.com/docs/overview",
    "lastVerifiedAt": "2026-04-28"
  },
  {
    "id": "route-google-gemini25pro-direct",
    "modelId": "google-gemini-2-5-pro",
    "providerId": "google",
    "routeType": "direct",
    "label": "Google Gemini API",
    "baseUrl": "https://generativelanguage.googleapis.com",
    "authMethod": "api-key",
    "requiredSecrets": ["GEMINI_API_KEY"],
    "supportsStreaming": true,
    "supportsTools": true,
    "supportsStructuredOutput": true,
    "supportsReasoningMode": true,
    "status": "active",
    "recordStatus": "reviewed",
    "sourceUrl": "https://ai.google.dev/gemini-api/docs",
    "lastVerifiedAt": "2026-04-28"
  },
  {
    "id": "route-groq-llama33-direct",
    "modelId": "groq-llama-3-3-70b",
    "providerId": "groq",
    "routeType": "direct",
    "label": "Groq API",
    "baseUrl": "https://api.groq.com/openai/v1",
    "authMethod": "api-key",
    "requiredSecrets": ["GROQ_API_KEY"],
    "supportsStreaming": true,
    "supportsTools": true,
    "supportsStructuredOutput": true,
    "supportsReasoningMode": false,
    "status": "active",
    "recordStatus": "reviewed",
    "sourceUrl": "https://console.groq.com/docs/overview",
    "lastVerifiedAt": "2026-04-28"
  },
  {
    "id": "route-openrouter-sonnet-agg",
    "modelId": "openrouter-claude-sonnet-4-6",
    "providerId": "openrouter",
    "routeType": "aggregator",
    "label": "OpenRouter aggregated route",
    "baseUrl": "https://openrouter.ai/api/v1",
    "authMethod": "api-key",
    "requiredSecrets": ["OPENROUTER_API_KEY"],
    "supportsStreaming": true,
    "supportsTools": true,
    "supportsStructuredOutput": true,
    "supportsReasoningMode": true,
    "status": "active",
    "recordStatus": "reviewed",
    "sourceUrl": "https://openrouter.ai/docs/overview/introduction",
    "lastVerifiedAt": "2026-04-28"
  }
]
